{
  "schema_version":"1.0",
  "metadata":{"model_id":"two-part","name":"Tvådelad testmodell","description":"MPD-exporttest","status":"draft"},
  "requirements":{"source_prompt":"Skapa testmodell","design_intent":"Testa submodellsexport"},
  "dimensions":{"unit":"LDU","min":{"x":0,"y":-24,"z":0},"max":{"x":80,"y":0,"z":40}},
  "submodels":[
    {"id":"main","name":"Huvudmodell","parts":[{"instance_id":"p1","ldraw_part":"3001.dat","color":4,"placement":{"position":{"x":0,"y":0,"z":0},"rotation":[1,0,0,0,1,0,0,0,1]},"validation":{"catalog_reference":"verified","placement":"unchecked"}}],"submodel_instances":[{"instance_id":"s1","submodel_id":"roof","color":16,"placement":{"position":{"x":0,"y":-24,"z":0},"rotation":[1,0,0,0,1,0,0,0,1]}}]},
    {"id":"roof","name":"Tak","parts":[{"instance_id":"p2","ldraw_part":"3003.dat","color":1,"placement":{"position":{"x":0,"y":0,"z":0},"rotation":[1,0,0,0,1,0,0,0,1]},"validation":{"catalog_reference":"verified","placement":"unchecked"}}]}
  ],
  "validation":{"schema":"pending","catalog":"pending","geometry":"pending","messages":[]}
}
